{
  "schema_version": "1.0.0",
  "report_id": "mrr-scalp-example-001",
  "mode": "SCALP",
  "mode_priority": "PRIMARY",
  "report_type": "primary_research_report",
  "created_at": "2026-06-20T00:00:00Z",
  "run_id": "run-example-scalp-001",
  "data_scope": {
    "symbols": ["BTCUSDT"],
    "date_range_start": "2025-01-01T00:00:00Z",
    "date_range_end": "2026-06-01T00:00:00Z",
    "primary_timeframes": ["1h"],
    "secondary_timeframes": ["4h", "15m"],
    "data_quality_summary": "P0.8E: timeframes corrected to locked simulation profile: SCALP primary 1h, context 4h, refinement 15m."
  },
  "feature_set_refs": ["fs-scalp-example-001"],
  "label_dataset_refs": ["lds-scalp-example-001"],
  "alpha_theses": [
    {
      "alpha_thesis_id": "ath-scalp-example-001",
      "title": "Example SCALP momentum thesis (dummy)",
      "status": "PROPOSED",
      "evidence_quality": "INSUFFICIENT"
    }
  ],
  "validation_summary": {
    "validation_report_id": "vr-scalp-example-001",
    "fold_count": 6,
    "verdict": "INCONCLUSIVE",
    "overfit_risk": "HIGH"
  },
  "metrics": {
    "oos_ic": { "value": 0.0, "ci_lower": -1.0, "ci_upper": 1.0, "ci_level": 0.95 },
    "oos_rank_ic": { "value": 0.0, "ci_lower": -1.0, "ci_upper": 1.0, "ci_level": 0.95 },
    "oos_sharpe": { "value": 0.0, "ci_lower": -1.0, "ci_upper": 1.0, "ci_level": 0.95 },
    "oos_expectancy_r": { "value": 0.0, "ci_lower": -0.5, "ci_upper": 0.5, "ci_level": 0.95 },
    "oos_win_rate": { "value": 0.4, "ci_lower": 0.2, "ci_upper": 0.6, "ci_level": 0.95 },
    "oos_profit_factor": { "value": 0.8, "ci_lower": 0.5, "ci_upper": 1.2, "ci_level": 0.95 },
    "oos_max_drawdown_r": { "value": -5.0, "ci_lower": -10.0, "ci_upper": -2.0, "ci_level": 0.95 },
    "oos_trade_count": 0,
    "active_trade_count": 0,
    "long_trade_count": 0,
    "short_trade_count": 0,
    "no_trade_count": 0,
    "total_gross_R": 0.0,
    "total_net_R": 0.0,
    "exposure_pct": 0.0,
    "avg_net_R_per_active_trade": 0.0,
    "per_fold_metrics": [
      { "fold": 1, "sharpe": 0.0, "expectancy_r": 0.0, "win_rate": 0.0, "trade_count": 0 },
      { "fold": 2, "sharpe": 0.0, "expectancy_r": 0.0, "win_rate": 0.0, "trade_count": 0 },
      { "fold": 3, "sharpe": 0.0, "expectancy_r": 0.0, "win_rate": 0.0, "trade_count": 0 },
      { "fold": 4, "sharpe": 0.0, "expectancy_r": 0.0, "win_rate": 0.0, "trade_count": 0 },
      { "fold": 5, "sharpe": 0.0, "expectancy_r": 0.0, "win_rate": 0.0, "trade_count": 0 },
      { "fold": 6, "sharpe": 0.0, "expectancy_r": 0.0, "win_rate": 0.0, "trade_count": 0 }
    ]
  },
  "cost_stress": {
    "baseline_fee_pct": 0.04,
    "baseline_slippage_pct": 0.02,
    "fee_stress_levels": [
      { "multiplier": 1.0, "oos_expectancy_r": 0.0, "edge_survives": false },
      { "multiplier": 1.5, "oos_expectancy_r": -0.1, "edge_survives": false },
      { "multiplier": 2.0, "oos_expectancy_r": -0.2, "edge_survives": false }
    ],
    "slippage_stress_levels": [
      { "multiplier": 1.0, "oos_expectancy_r": 0.0, "edge_survives": false },
      { "multiplier": 1.5, "oos_expectancy_r": -0.1, "edge_survives": false },
      { "multiplier": 2.0, "oos_expectancy_r": -0.2, "edge_survives": false }
    ],
    "combined_stress_edge_survives": false,
    "break_even_cost_total_pct": 0.01,
    "cost_stress_verdict": "FAIL_EDGE_DESTROYED_BY_COSTS",
    "net_edge_after_costs": -0.01
  },
  "no_trade_comparison": {
    "long_vs_no_trade": "NO_TRADE beats LONG in dummy example",
    "short_vs_no_trade": "NO_TRADE beats SHORT in dummy example",
    "active_beats_no_trade": false,
    "no_trade_baseline": "NO_TRADE dominates — dummy example",
    "saved_loss_count": 0,
    "missed_opportunity_count": 0,
    "trade_vs_no_trade_verdict": "NO_TRADE_DOMINATES",
    "summary": "Dummy example — no real edge demonstrated. NO_TRADE dominates."
  },
  "regime_breakdown": {
    "regimes_tested": ["TREND_UP", "TREND_DOWN", "RANGE", "TRANSITION"],
    "regimes": [
      { "regime": "TREND_UP", "sample_pct": 0.25, "oos_expectancy_r": 0.0, "edge_present": false },
      { "regime": "TREND_DOWN", "sample_pct": 0.25, "oos_expectancy_r": 0.0, "edge_present": false },
      { "regime": "RANGE", "sample_pct": 0.25, "oos_expectancy_r": 0.0, "edge_present": false },
      { "regime": "TRANSITION", "sample_pct": 0.25, "oos_expectancy_r": 0.0, "edge_present": false }
    ],
    "best_regime": "NONE",
    "worst_regime": "NONE",
    "edge_only_in_rare_regime": false,
    "regime_stability_verdict": "NOT_EVALUATED",
    "summary": "P0.8E: regime taxonomy aligned to V7 evaluation.md (TREND_UP/DOWN/RANGE/TRANSITION)."
  },
  "v7_gate_readiness": {
    "gates_mapped": ["G0_doc_ready", "G1_research_backtest", "G2_walk_forward_oos", "G3_cost_stress", "G4_regime_breakdown", "G5_symbol_stability"],
    "gates_not_ready": ["G6_calibration_reliability", "G7_shadow", "G8_paper", "G9_tiny_live", "G10_live"],
    "overall_readiness": "NOT_READY"
  },
  "multiple_hypothesis_control": {
    "tested_hypothesis_count": 1,
    "correction_method": "NONE_APPLIED",
    "corrected_significance": null,
    "data_snooping_risk_flag": "HIGH",
    "deflated_sharpe_or_equivalent": null,
    "mht_computed_for_real": false,
    "notes": "Dummy fixture — no real hypothesis testing. P0.8E: MHT field added."
  },
  "verdict": "CONTINUE_RESEARCH",
  "blocked_scopes": [
    "No real empirical data — this is a minimal fixture example",
    "Funding model DEFERRED — perpetual/live scope blocked",
    "SCALP thresholds HOLD — not lockable without empirical evidence"
  ],
  "limitations": [
    "This is a minimal fixture for schema validation only",
    "All metric values are dummy zeros — do not interpret as real research",
    "Single symbol limitation (BTCUSDT only)",
    "No real trades executed",
    "P0.8E: timeframes corrected to locked profile: SCALP primary 1h"
  ],
  "recommended_actions": [
    "Obtain real market data at 1h primary timeframe",
    "Run SCALP simulation with locked profile (1h primary / 4h context / 15m refinement)",
    "Generate real labels from SimulationOutput",
    "Compute features and train models with real data",
    "Re-evaluate after empirical evidence is available"
  ]
}